{
    "$schema": "https://raw.githubusercontent.com/raharrison/lynks-server/master/config/lynks.schema.json",
    "server": {
        "port": 8080,
        "rootPath": "/api"
    },
    "auth": {
        "enabled": false
    },
    "resource": {
        "resourceBasePath": "media",
        "resourceTempPath": "media/temp"
    },
    "external": {
        "scraperHost": "http://localhost:3000/api"
    }
}
